{
  "$schema": "https://json-schema.org/draft/2020-12/schema",
  "$id": "https://posselt.at/pf2e-kingmaker-tools/schemas/recipe.json",
  "title": "Recipe",
  "description": "A recipe",
  "$ref": "#/$defs/Recipe",
  "$defs": {
    "Rarity": {
      "type": "string",
      "enum": [
        "common",
        "uncommon",
        "rare",
        "unique"
      ]
    },
    "Currency": {
      "type": "string",
      "enum": [
        "cp",
        "sp",
        "gp",
        "pp"
      ]
    },
    "Recipe": {
      "type": "object",
      "required": [
        "id",
        "name",
        "basicIngredients",
        "specialIngredients",
        "cookingLoreDC",
        "survivalDC",
        "uuid",
        "level",
        "cost",
        "rarity",
        "criticalSuccess",
        "success",
        "criticalFailure"
      ],
      "properties": {
        "id": {
          "type": "string"
        },
        "isSpecialMeal": {
          "type": "boolean"
        },
        "name": {
          "type": "string"
        },
        "icon": {
          "type": "string"
        },
        "basicIngredients": {
          "type": "number"
        },
        "specialIngredients": {
          "type": "number"
        },
        "cookingLoreDC": {
          "type": "number"
        },
        "survivalDC": {
          "type": "number"
        },
        "uuid": {
          "type": "string"
        },
        "level": {
          "type": "number"
        },
        "cost": {
          "type": "object",
          "required": [
            "value",
            "currency"
          ],
          "properties": {
            "value": {
              "type": "number"
            },
            "currency": {
              "$ref": "#/$defs/Currency"
            }
          }
        },
        "rarity": {
          "$ref": "#/$defs/Rarity"
        },
        "isHomebrew": {
          "type": "boolean"
        },
        "requirements": {
          "type": "string"
        },
        "criticalSuccess": {
          "$ref": "#/$defs/CookingOutcome"
        },
        "success": {
          "$ref": "#/$defs/CookingOutcome"
        },
        "criticalFailure": {
          "$ref": "#/$defs/CookingOutcome"
        },
        "favoriteMeal": {
          "$ref": "#/$defs/CookingOutcome"
        }
      }
    },
    "CookingOutcome": {
      "type": "object",
      "properties": {
        "effects": {
          "type": "array",
          "items": {
            "$ref": "#/$defs/MealEffect"
          }
        },
        "chooseRandomly": {
          "type": "boolean"
        },
        "message": {
          "type": "string"
        }
      }
    },
    "Conditions": {
      "type": "object",
      "required": [
        "condition",
        "value"
      ],
      "properties": {
        "condition": {
          "type": "string",
          "enum": [
            "drained",
            "enfeebled",
            "stupefied",
            "clumsy"
          ]
        },
        "value": {
          "type": "number"
        },
        "afterRest": {
          "type": "boolean"
        }
      }
    },
    "MealEffect": {
      "type": "object",
      "properties": {
        "uuid": {
          "type": "string"
        },
        "removeWhenPreparingCampsite": {
          "type": "boolean"
        },
        "removeAfterRest": {
          "type": "boolean"
        },
        "changeRestDurationSeconds": {
          "type": "number"
        },
        "changeFatigueDurationSeconds": {
          "type": "number"
        },
        "reduceConditions": {
          "type": "object",
          "mode": {
            "type": "string",
            "enum": [
              "all",
              "random"
            ]
          },
          "drained": {
            "type": "number"
          },
          "stupefied": {
            "type": "number"
          },
          "clumsy": {
            "type": "number"
          },
          "enfeebled": {
            "type": "number"
          },
          "afterRest": {
            "type": "boolean"
          }
        },
        "doublesHealing": {
          "type": "boolean"
        },
        "halvesHealing": {
          "type": "boolean"
        },
        "healMode": {
          "type": "string",
          "enum": [
            "afterConsumption",
            "afterRest",
            "afterConsumptionAndRest"
          ]
        },
        "healFormula": {
          "type": "string"
        },
        "damageFormula": {
          "type": "string"
        },
        "grantsFreeAction": {
          "type": "object",
          "properties": {
            "type": {
              "type": "string",
              "enum": [
                "freeAction",
                "singleAction",
                "reaction"
              ]
            },
            "name": {
              "type": "string"
            },
            "description": {
              "type": "string"
            },
            "durationSeconds": {
              "type": "number"
            }
          },
          "required": [
            "type",
            "name"
          ]
        },
        "grantsReaction": {
          "type": "object",
          "properties": {
            "type": {
              "type": "string",
              "enum": [
                "freeAction",
                "singleAction",
                "reaction"
              ]
            },
            "name": {
              "type": "string"
            },
            "description": {
              "type": "string"
            },
            "durationSeconds": {
              "type": "number"
            }
          },
          "required": [
            "type",
            "name"
          ]
        }
      },
      "required": [
        "uuid"
      ]
    }
  }
}