{
  "id": "succulent-sausages",
  "name": "recipes.succulent-sausages.name",
  "icon": "icons/consumables/food/sausage-bratwurst-mustard-red-yellow.webp",
  "basicIngredients": 3,
  "specialIngredients": 1,
  "cookingLoreDC": 18,
  "survivalDC": 20,
  "uuid": "Compendium.pf2e-kingmaker-tools.kingmaker-tools-meal-effects.IZoPx6QH5NRY1HBi",
  "level": 3,
  "cost": {
    "currency": "gp",
    "value": 3
  },
  "rarity": "common",
  "favoriteMeal": {
    "effects": [
      {
        "uuid": "Compendium.pf2e-kingmaker-tools.kingmaker-tools-meal-effects.Item.EULsp9VffKbWpD0b",
        "removeWhenPreparingCampsite": false
      }
    ]
  },
  "success": {
    "effects": [
      {
        "uuid": "Compendium.pf2e-kingmaker-tools.kingmaker-tools-meal-effects.Item.G0qnixpCakGeHTp1",
        "removeAfterRest": true,
        "grantsReaction": {
          "type": "reaction",
          "name": "recipes.succulent-sausages.reaction.name",
          "description": "recipes.succulent-sausages.reaction.description"
        }
      }
    ]
  },
  "criticalFailure": {
    "effects": [
      {
        "uuid": "Compendium.pf2e-kingmaker-tools.kingmaker-tools-meal-effects.Item.WDJQpYYx0N91mkO0",
        "removeAfterRest": true
      }
    ]
  },
  "criticalSuccess": {
    "effects": [
      {
        "uuid": "Compendium.pf2e-kingmaker-tools.kingmaker-tools-meal-effects.Item.jseoPPvbPg4Vr7MI",
        "removeWhenPreparingCampsite": false,
        "grantsReaction": {
          "type": "reaction",
          "name": "recipes.succulent-sausages.reaction.name",
          "description": "recipes.succulent-sausages.reaction.description"
        }
      }
    ]
  }
}